{
  "schemaVersion": 1,
  "gameBuild": "25677108",
  "units": "meters",
  "weapons": [
    {
      "id": "Id.Item.A91",
      "name": "A-91",
      "asset": "Plugins/GameFeatures/Weapons/Platforms/WEPN_004/Content/Data/DA_A91_Stats",
      "fireModes": [
        "SemiAutomatic",
        "Burst"
      ],
      "rpm": 700,
      "calibers": [
        "556mm"
      ],
      "muzzleVelocity": 715,
      "effectiveRange": 300,
      "damageFalloff": [
        {
          "distance": 0,
          "multiplier": 1
        },
        {
          "distance": 300,
          "multiplier": 1
        },
        {
          "distance": 1200,
          "multiplier": 0.2
        }
      ],
      "accuracy": 1.5,
      "randomDeviation": 15,
      "meleeDamage": 35,
      "suppressionMultiplier": 1.3,
      "recoil": {
        "pattern": [
          {
            "x": 0,
            "y": 0.85
          },
          {
            "x": 0.03,
            "y": 1.02
          },
          {
            "x": 0.055,
            "y": 1.15
          },
          {
            "x": 0.075,
            "y": 1.24
          },
          {
            "x": 0.09,
            "y": 1.28
          },
          {
            "x": 0.095,
            "y": 1.3
          },
          {
            "x": 0.092,
            "y": 1.3
          },
          {
            "x": 0.085,
            "y": 1.285
          },
          {
            "x": 0.075,
            "y": 1.265
          },
          {
            "x": 0.065,
            "y": 1.245
          },
          {
            "x": 0.055,
            "y": 1.23
          },
          {
            "x": 0.045,
            "y": 1.215
          },
          {
            "x": 0.035,
            "y": 1.2
          },
          {
            "x": 0.025,
            "y": 1.19
          },
          {
            "x": -0.015,
            "y": 1.18
          },
          {
            "x": -0.04,
            "y": 1.17
          },
          {
            "x": -0.058,
            "y": 1.16
          },
          {
            "x": -0.065,
            "y": 1.155
          },
          {
            "x": -0.06,
            "y": 1.15
          },
          {
            "x": -0.048,
            "y": 1.145
          },
          {
            "x": -0.03,
            "y": 1.14
          },
          {
            "x": -0.012,
            "y": 1.13
          },
          {
            "x": 0.018,
            "y": 1.12
          },
          {
            "x": 0.038,
            "y": 1.115
          },
          {
            "x": 0.052,
            "y": 1.11
          },
          {
            "x": 0.058,
            "y": 1.105
          },
          {
            "x": 0.052,
            "y": 1.1
          },
          {
            "x": 0.04,
            "y": 1.05
          },
          {
            "x": 0.025,
            "y": 1.02
          },
          {
            "x": 0.01,
            "y": 1
          }
        ],
        "patternResetTime": 0.78,
        "afterPatternPitch": [
          0.5,
          0.72
        ],
        "afterPatternYaw": [
          -0.25,
          0.25
        ]
      },
      "slots": [
        {
          "slot": "Chamber",
          "items": [],
          "contexts": [
            "Item.Caliber.556mm"
          ],
          "filter": "AllowList",
          "blockedItems": [],
          "blockedContexts": [],
          "hidden": true
        },
        {
          "slot": "Sight",
          "items": [],
          "contexts": [],
          "filter": "BlockPriority",
          "blockedItems": [
            "Id.Item.SniperScope10x",
            "Id.Item.HybridScope4x",
            "Id.Item.10xScopeMoa"
          ],
          "blockedContexts": [],
          "hidden": true
        },
        {
          "slot": "Magazine",
          "items": [
            "Id.Item.STANAGMagazine",
            "Id.Item.STANAGExtendedMagazine",
            "Id.Item.STANAGMagazine20rd"
          ],
          "contexts": [
            "Item.Attachment.Magazine.AR"
          ],
          "filter": "AllowList",
          "blockedItems": [],
          "blockedContexts": [],
          "hidden": false
        },
        {
          "slot": "Barrel",
          "items": [
            "ID.Item.A91Barrel"
          ],
          "contexts": [],
          "filter": "AllowList",
          "blockedItems": [],
          "blockedContexts": [],
          "hidden": true
        }
      ]
    },
    {
      "id": "Id.Item.AK74M",
      "name": "AK74",
      "asset": "Plugins/GameFeatures/Weapons/Platforms/WEPN_001/Content/Data/DA_AK74M_Stats",
      "fireModes": [
        "Automatic",
        "SemiAutomatic"
      ],
      "rpm": 650,
      "calibers": [
        "545mm"
      ],
      "muzzleVelocity": 880,
      "effectiveRange": 500,
      "damageFalloff": [
        {
          "distance": 0,
          "multiplier": 1
        },
        {
          "distance": 500,
          "multiplier": 1
        },
        {
          "distance": 1200,
          "multiplier": 0.2
        }
      ],
      "accuracy": 0.825,
      "randomDeviation": 13,
      "adsTime": 0.8,
      "zeroing": {
        "max": 1000
      },
      "meleeDamage": 35,
      "recoil": {
        "pattern": [
          {
            "x": 0.01,
            "y": 0.717554
          },
          {
            "x": -0.02,
            "y": 0.936807
          },
          {
            "x": 0.025,
            "y": 1.07633
          },
          {
            "x": 0.045,
            "y": 1.146093
          },
          {
            "x": 0.07,
            "y": 1.215855
          },
          {
            "x": 0.085,
            "y": 1.245753
          },
          {
            "x": 0.08,
            "y": 1.225821
          },
          {
            "x": 0.07,
            "y": 1.195923
          },
          {
            "x": 0.06,
            "y": 1.175991
          },
          {
            "x": 0.055,
            "y": 1.156059
          },
          {
            "x": 0.045,
            "y": 1.146093
          },
          {
            "x": 0.04,
            "y": 1.136127
          },
          {
            "x": 0.03,
            "y": 1.12616
          },
          {
            "x": 0.025,
            "y": 1.116195
          },
          {
            "x": -0.03,
            "y": 1.096263
          },
          {
            "x": -0.055,
            "y": 1.096263
          },
          {
            "x": -0.065,
            "y": 1.086296
          },
          {
            "x": -0.06,
            "y": 1.07633
          },
          {
            "x": -0.05,
            "y": 1.086296
          },
          {
            "x": -0.04,
            "y": 1.07633
          },
          {
            "x": -0.03,
            "y": 1.066365
          },
          {
            "x": -0.02,
            "y": 1.066365
          },
          {
            "x": 0.015,
            "y": 1.056399
          },
          {
            "x": 0.035,
            "y": 1.056399
          },
          {
            "x": 0.055,
            "y": 1.046432
          },
          {
            "x": 0.065,
            "y": 1.036466
          },
          {
            "x": 0.06,
            "y": 1.026501
          },
          {
            "x": 0.05,
            "y": 1.016535
          },
          {
            "x": 0.04,
            "y": 1.006568
          },
          {
            "x": 0.03,
            "y": 0.946772
          }
        ],
        "patternResetTime": 0.65,
        "viewKickMultiplier": 1.1,
        "afterPatternPitch": [
          0.45,
          0.75
        ],
        "afterPatternYaw": [
          -0.28,
          0.28
        ]
      },
      "slots": [
        {
          "slot": "Chamber",
          "items": [],
          "contexts": [
            "Item.Caliber.545mm"
          ],
          "filter": "AllowList",
          "blockedItems": [],
          "blockedContexts": [
            "Item.Caliber.556mm"
          ],
          "hidden": true
        },
        {
          "slot": "Sight",
          "items": [
            "Id.Item.3xScope",
            "Id.Item.4xElcanSpectr",
            "Id.Item.SGHT_030"
          ],
          "contexts": [
            "Item.Attachment.Sight.Short",
            "Item.Attachment.Sight.Medium"
          ],
          "filter": "BlockPriority",
          "blockedItems": [],
          "blockedContexts": [],
          "hidden": false
        },
        {
          "slot": "Magazine",
          "items": [
            "Id.Item.AK74MMagazine",
            "Id.Item.AK74MExtendedMagazine",
            "Id.Item.AK74MMagazine75rnd"
          ],
          "contexts": [
            "Item.Attachment.Magazine.AK74M"
          ],
          "filter": "AllowList",
          "blockedItems": [],
          "blockedContexts": [],
          "default": "Id.Item.AK74MMagazine",
          "hidden": false
        },
        {
          "slot": "Stock",
          "items": [],
          "contexts": [
            "Item.Attachment.Stock.AK74M"
          ],
          "filter": "BlockPriority",
          "blockedItems": [],
          "blockedContexts": [],
          "hidden": true
        },
        {
          "slot": "Grip",
          "items": [],
          "contexts": [
            "Item.Attachment.Grip.AK74M"
          ],
          "filter": "BlockPriority",
          "blockedItems": [],
          "blockedContexts": [],
          "hidden": true
        },
        {
          "slot": "Barrel",
          "items": [
            "Id.Item.AK74MBarrel",
            "ID.Item.AR_01_BRL_02"
          ],
          "contexts": [],
          "filter": "AllowList",
          "blockedItems": [],
          "blockedContexts": [],
          "hidden": true
        },
        {
          "slot": "Underbarrel",
          "items": [],
          "contexts": [
            "Item.Attachment.Underbarrel"
          ],
          "filter": "BlockPriority",